{
  "$schema": "https://json-schema.org/draft/2020-12/schema",
  "title": "CogniStream Event Schema",
  "description": "Standard schema for GitHub, Slack, and IDE events.",
  "type": "object",
  "required": [
    "event_id",
    "user_id",
    "project_name",
    "event_type",
    "event_timestamp",
    "metadata"
  ],
  "properties": {
    "event_id": {
      "type": "string",
      "description": "Unique identifier for the event"
    },
    "user_id": {
      "type": "string",
      "description": "Identifier of the user generating the event"
    },
    "project_name": {
      "type": "string"
    },
    "event_type": {
      "type": "string"
    },
    "event_timestamp": {
      "type": "string",
      "format": "date-time"
    },
    "metadata": {
      "type": "object",
      "description": "Additional event-specific information"
    }
  },
  "additionalProperties": false
}